product_url,product_name,description,price,currency,product_rating,color,availability,shipping,delivery_date,delivery_cost,warranty,warranty_policy,condition,image,latest_reviews
https://www.amazon.com/Muir-Glen-Organic-Tomato-Sauce/dp/B000LKXG64,"Muir Glen Organic Tomato Sauce, 15 oz. (Pack of 12)","Add big flavor to your homemade pasta sauce or favorite soup recipe with Muir Glen Organic Tomato Sauce. This tomato sauce is made with vine-sweetened tomatoes for the perfect taste. Muir Glen organic tomatoes are grown in the soil of California and are perfectly pureed and lightly salted to create rich and creamy tomato sauce. USDA Certified Organic, Non-GMO Project Verified and gluten free, Muir Glen Organic Tomato Sauce is the perfect addition to shakshuka, ratatouille, pizza sauce or your favorite sloppy joes. Muir Glen organic tomatoes fresh from the vine are an easy and delicious way to upgrade your favorite recipes. These organic tomatoes are grown in California and are canned quickly for peak freshness.",45.99,$,4.5,[],True,False,,,False,,new,https://m.media-amazon.com/images/I/5144XKEr9SL._SX300_SY300_QL70_ML2_.jpg,"['Honestly I love this sauce and use it all of the time.  It is lower in acidity than many others (at least for me) and with a few fresh additions (garlic, onion, pepper flakes etc) its great.  Although its great on its own too!', 'The order was well packed, but a few cans were severely dented and others just a little dented. This may not bother some people, but it bothers me. The cans were not broke. The sauce itself is my favorite, that’s why I bought it.', 'I have been making Pasta Fagioli for years and lately I tried using this tomato sauce.  This is the best sauce I have ever used for this recipe.  My husband said it is recommended by chefs.  I can see why.', ""Whether I'm making pasta, pizza, or whatever, I start with Muir Glen's sauce. The quality is unmatched. I'm grateful to be able to get it in a 12-pack.""]"
https://www.amazon.com/KC-Natural-Traditional-Tomato-Sodium/dp/B0BD5LCJ64,"KC Natural | Traditional Style Tomato Free Pasta Sauce | 280mg Sodium (2-pack, 1.00)","Tomato Free, Vegan, 280mg of Sodium Per Serv., Paleo AIP, Refined Sugar Free, Nightshade Free",21.99,$,4.0,[],True,False,,,False,,new,https://m.media-amazon.com/images/I/41-nFAGxf8L._SX300_SY300_QL70_ML2_.jpg,"[{'reviewTitle': 'Night shade free', 'rating': 5, 'reviewBody': 'This was delicious. Having a night shade allergy it’s difficult to find options for a quick meal. Of course it’s not exactly like a tomato sauce but it’s similar. Most importantly it’s not a cream sauce or oily pesto.  It’s super healthy and the flavor is wonderful.', 'verifiedPurchase': True}, {'reviewTitle': ""That'll do, pig"", 'rating': 4, 'reviewBody': 'No, seriously. We tried. He has a nightshade sensitivity, and we tried to make a half a dozen different ""nomato"" sauces for spaghetti and lasagna. We gave up all hope until we found KC. It\'s not the same, but it works and tastes fabulous. A little caraway and oregano, and it tastes even better.', 'verifiedPurchase': True}, {'reviewTitle': 'ick', 'rating': 1, 'reviewBody': ""I have had no mato sauce and this isn't it.  I have been on an AIP diet 5 years so am used to having substitutes. This sauce was not even edible. I tried so hard because it was so incredibly expensive but finally threw out over half the jar."", 'verifiedPurchase': True}, {'reviewTitle': 'Fantastic taste!', 'rating': 5, 'reviewBody': ""I haven't been able to have any tomato products for over two years.  Imagine my surprise when my son found your products made with carrots and cherries.  Thank you so much for adding yummy tastes to my eating."", 'verifiedPurchase': True}, {'reviewTitle': 'Finally', 'rating': 5, 'reviewBody': ""I'm allergic to nightshades, and now I finally can have the flavor I crave.  2 drawbacks....<br/>1. it's not red enough for my eyes to register the sauce as being authentic, but this also tells me they did not use fake coloring.<br/>2. a bit too sweet for my taste, though some like that.  I would put the sweetness on par with Prego.<br/><br/>Still I will buy again"", 'verifiedPurchase': True}, {'reviewTitle': 'Not for low acid diets!', 'rating': 3, 'reviewBody': 'Read the fine print - the third ingredient is balsamic vinegar. While the taste was pretty good, it isn’t suitable for low acid protocols - which was what I bought it for.', 'verifiedPurchase': True}, {'reviewTitle': 'Great!', 'rating': 5, 'reviewBody': 'This product is great! I can’t do tomatoes due to having IC - if you know what that is you know it’s a pain in the butt! I miss my acidic foods! Especially tomato products!! This works great in place of tomato sauce/paste like stuff. Been a game changer for me!', 'verifiedPurchase': True}]"
https://www.amazon.com/Prego-Pasta-Sauce-Sugar-Traditional/dp/B07DFRQLNQ/ref=zg_bs_g_6465030011_d_sccl_9/130-0780116-4726006?psc=1,"Prego Traditional No Sugar Added Pasta Sauce, 23.5 Oz Jar","Be the hero at dinner with Prego Traditional No Sugar Added Pasta Sauce. Versatile and delicious, this classic red sauce features the rich, sweet taste of vine-ripened tomatoes balanced with flavorful herbs and seasonings, with no sugar added (1). This pasta sauce has a taste everyone loves and a thick texture that doesn’t water out, making it a perfect pairing with any pasta. Prego pasta sauce is gluten free, vegan and made without artificial colors or added MSG for a spaghetti sauce you can feel good about. Top off any pasta with this Prego Italian sauce for a quick, family-pleasing meal, or use it as a base for your favorite recipes. The tomato sauce jar top is easy to close and store in the refrigerator for leftovers. Give your family the taste everyone loves with Prego sauces. In addition to Traditional No Sugar Added Pasta Sauce, Prego offers a variety of favorites, including Chunky Tomato, Garlic and Onion Italian, Low FODMAP and more! (1) Not a calorie reduced food. See nutrition facts panel for sugar and calorie content",2.48,$,4.6,[],True,False,,,False,,new,https://m.media-amazon.com/images/I/41t8PN4cYmL._SX300_SY300_QL70_ML2_.jpg,"['This didn’t taste sugar free. Very good taste. Great value and texture.', ""As far as sugar free sauces this one's one a our favorites ,nice sized,great quality, great value for your money tastes really yummy low salt few ingredients really good 👍 😋"", 'Tastes great, and so different from the other Prego varieties that it makes you realize how much sugar the other varieties must have.  Also, how unnecessary all that added sugar is.', 'Very good and full flavor.', 'This was a really helpful product when I was trying to watch my sugar intake in my diet, didn’t know this type of product even existed so I appreciated finding it and using it!']"
https://www.amazon.com/Prego-Traditional-Italian-Sensitive-Recipe/dp/B07DFQMRRR/ref=zg_bs_g_6465030011_d_sccl_10/130-0780116-4726006?psc=1,"Prego Traditional Sensitive Recipe Low FODMAP Pasta Sauce, 23.75 Oz Jar","One (1) 23.75 oz jar of Prego Traditional Sensitive Recipe Low FODMAP Pasta Sauce  Low FODMAP spaghetti sauce with thickness you can see and a taste that everyone loves, without garlic and onions that may cause stomach sensitivities  This Prego sauce features the rich, sweet taste of vine-ripened tomatoes balanced with flavorful herbs and seasonings  Each half cup serving of this gluten free, vegan sauce is a good source of fiber, and does not contain artificial colors or added MSG  Makes a great spaghetti sauce, bolognese sauce or base to other recipes",2.79,$,4.5,[],True,False,,,False,,new,https://m.media-amazon.com/images/I/41XMbVUY0yL._SX300_SY300_QL70_ML2_.jpg,"['Wow! Surprised How Good this Tastes!', 'Thank you so much!', 'A Good Sensitive Recipe Sauce Choice At A Great Price', 'Parosmia', 'Great product! Low fodmap!', ""Can't Beat The Value For Flavor and FODMOP Friendly"", 'It will arrive broken']"
https://www.amazon.com/Classico-Italian-Sausage-Peppers-Onions/dp/B000RY88VC,"Classico Italian Sausage Spaghetti Pasta Sauce with Tomato, Peppers & Onions (24 oz Jar)","Classico Italian Sausage With Peppers & Onions Pasta Sauce adds authentic Italian flavor to recipes. Blend tomato puree and green bell peppers with Italian sausage, garlic, onion and spices. Serve over baked ziti or in pasta bake. Packaged in a resealable & reusable Mason jar. Refrigerate Classico pasta sauce after opening.",2.79,$,4.6,[],True,False,,,False,,new,https://m.media-amazon.com/images/I/41x6q3FKmiL._SX300_SY300_QL70_ML2_.jpg,"['High quality, one of my favorite brands & flavors. Authentic Italian sausage taste. Perfect in all my Italian dishes. Great price here most of the time. So expensive on my grocery store shelf these days! :(', 'This sauce is good with Spaghetti, Macaroni, Mac&cheese, and rice for tasty rich meals. Add in ground beef or meat balls as desired along with onions and peppers.', ""Great products in general a good friend recommended a while back, great options to choose from flavorwise too, make sure to glance around for one that sounds good. Already down to two harsh after my last purchase. I also highly recommend. Lol contains tomato. I got multiple flavors, different sauces and one some how tasted like raw sausage but when I heated it up it actually seemed to cook. I've never had to doctor this brand before, but worth trying again"", 'Really good authentic Italian tasting pasta sauce for a quick meal without all the hassle of making from scratch.  Yummy!', ""My 3 Jars arrived on time and in perfect condition, well wrapped in bubble wrap and in a sturdy box.\nThe flavor of Classico's Roasted Garlic Flavor Spaghetti Sauce, to me, tastes divine!! Besides receiving it today, I also had delicious Spaghetti tonight for my Supper!! Thank you to Classico and also to Amazon for creating and providing such a highly recommended product!! Will buy again and very pleased!!""]"
