product_url,product_name,description,price,currency,product_rating,color,availability,shipping,delivery_date,delivery_cost,warranty,warranty_policy,condition,image,latest_reviews
https://www.amazon.com/Tourangelle-Organic-Extra-Virgin-Olive/dp/B00QGWM5HC,"La Tourangelle, Organic Extra Virgin Olive Oil, Cold-Pressed High Antioxidant Picual Olives From Spain, 25.4 Fl Oz","Olive oil lovers can now rejoice! La Tourangelle has released its first ever 100% Organic Extra Virgin Olive Oil perfect for the at-home chef’s daily use. La Tourangelle Extra Virgin Olive Oil is cold extracted from organically grown Picual olives harvested exclusively in a single family-owned estate in Andalucía, Spain. <br/>The olives are picked early and processed on-site within two hours to guarantee very low acidity and excellent quality. The result is a well-balanced sage green oil, intense and fruity with hints of freshly cut grass, almond and fresh olives leaves with a peppery finish. La Tourangelle Extra Virgin Olive Oil is an affordable organic oil ideal for everyday use. Wonderful for easy sautéing, baking, dipping, blending, drizzling, or for use in salad dressing. Once you discover La Tourangelle Extra Virgin Oil, it will become your go to Organic Olive Oil with its beautiful aroma and fresh flavor.<br/>Origin of olives: Andalucia, Spain. Suitable for medium-high heat.<br/>La Tourangelle is one of few remaining oil mills keeping a time-honored French heritage of roasting and pressing nut kernels into delicious oils. We are a family-owned company whose mastery of oil production is the fruit of passion, integrity, and pride. We strive to be the best artisan oil producer, dedicated to making carefully crafted, sustainable, natural products. With artisan care, we extract the seeds' essence and hidden natural treasures to create amazing products that bring delight in the kitchen and well being for the body.",19.96,$,4.7,"['Avocado', 'California EVOO', 'Extra Virgin Avocado', 'Organic Extra Virgin Olive', 'Toasted Sesame']",True,False,,,False,,new,https://m.media-amazon.com/images/I/41E5XrymTmL._SX300_SY300_QL70_ML2_.jpg,"['High quality oil. A staple in my kitchen.', 'Excellent Avocado Oil...Read edited updated review for more info', 'Excellent Brand @ Great Price', 'Good quality.  Expensive.  But what isn’t expensive !', ""Didn't think I'd get a dwarf bottle for 40$"", 'Decent quality, low on flavor', 'Good product', 'Love love love']"
https://www.amazon.com/ATLAS-Moroccan-Extra-Virgin-Olive/dp/B006U8PNIU,Atlas 750 mL Organic Cold Press Extra Virgin Olive Oil with Polyphenol Rich from Morocco | Newly Harvested Unprocessed from One Single Family Farm | Moroccan EVOO Trusted by Michelin Star Chefs,"【 The Highest Quality Cold-Pressed Moroccan Olive Oil】 The Atlas Mountains of Morocco help grow the most perfect olives in the world, thanks to the rare climate and the geographical advantage of the high-reaching area. We, at Atlas Olive Oils, pride ourselves on producing the highest quality cold-pressed Moroccan olive oil, which is sustainably sourced and ethically produced.  【 Maximum Health Benefits with Only Single Pressing of the Olives】 The Atlas Mountains of Morocco help grow the most perfect olives in the world, thanks to the rare climate and the geographical advantage of the high-reaching area. We, at Atlas Olive Oils, pride ourselves on producing the highest quality Cold Pressed Moroccan olive oil, which is sustainably sourced and ethically produced.  【 You will love the delicately complex aroma 】 that takes in almonds, culinary herbs and a mix of sweet bananas, lemons and basil. The taste and delicacy will please your palate too.  【 Our 100% organic Extra Virgin Moroccan Olive Oil 】 is free from added chemicals and destructive ingredients which makes the Olive Oil 100% SAFE . You can use this gently complex olive oil for general cooking as well as for baking and desserts.  【 10 Michelin-Starred Restaurants Use 】 our extra virgin olive oils to create dishes intended for an exclusive, refined and demanding public Exclusive restaurants and luxury hotels, but also high representative institutions and prestigious gourmet stores have chosen our olive oils. A perfect combination of organoleptic characteristics, chemical-physical qualities and sustainability that has been able to conquer many of the most rigorous and famous professionals of catering in the world.",22.94,$,4.7,['initial'],True,False,,,False,,new,https://m.media-amazon.com/images/I/314ZPRpO-XL._SX300_SY300_QL70_ML2_.jpg,"['“Rich Flavor and High Quality – A Must-Have Olive Oil!”', 'Polyphenols and great taste!', 'High quality, wonderful flavor', 'good flavor, fresh', 'Great flavor', 'Excelente y delicioso aceite auténtico de olivas virgen.  Valió mucho la pena la espera. Para mi es un poco  caro pero freocquexes de lo mejor entre lo mejor. Lo volvería a comprar.', 'Sehr gutes Olivenöl', 'Absolut zu empfehlen ☀️☀️☀️☀️☀️']"
https://www.amazon.com/365-Everyday-Value-Virgin-Mediterranean/dp/B074J9RL65,Extra Virgin Mediterranean Olive Oil,"Our standards are what set us apart, and our quality is what keeps us stocking pantries, fridges and freezers with the best natural and organic 365 Everyday Value products every day.",28.78,$,4.8,"['Olive 16.9 Fl Oz (Pack of 2)', 'Spanish 33.8 Fl Oz (Pack of 1)', 'olive 33.8 Fl Oz (Pack of 1)', 'Mediterranean Blend 33.8 Fl Oz (Pack of 1)', 'Olive 16.9 Fl Oz (Pack of 1)', 'Olive Oil 16.9 Fl Oz (Pack of 1)', 'Italian 33.8 Fl Oz (Pack of 1)', 'Greek 33.8 Fl Oz (Pack of 1)']",True,False,,,False,,new,https://m.media-amazon.com/images/I/31r0tOsmCBL._SX300_SY300_QL70_ML2_.jpg,"['Authentic', 'Excellent Olive Oil. Great Value!', 'Good price', 'Liquid Gold', 'It smells and taste as good as the popular generic Greek brands.']"
https://www.amazon.com/Virg-Italian-Olive-High-Polyphenols/dp/B09C3BQV2R,N°1 Drinking Extra Virgin Olive Oil - Italian Olive Oil from Italy 2024 Gold Award Winner - 665 mg/kg Polyphenol Rich Olive Oil - 100% Unrefined Cold pressed Olive Oil for Drinking and Finishing Use,"Supercharge with One Shot - Gourmet Extra Virgin Olive Oil - We Recommend Using Virgeen Raw to Fully Appreciate All Natural Oleocanthal and Polyphenol Proprieties- Taste One Daily Tablespoon, Drizzle It On Your Fresh Salad, Dip Your Favorite Bread  Awarded Winning Taste and Aroma - High Olive Polyphenols and Oleocanthal Content Lab Reports Inside Every Box (+665 mg/kg) - Polyphenol Rich Olive Oil - Recreate Natural Chefs Recipes With Virgeen Pure Olive Oil From Italy Rich In Polyphenols  Premium Fresh Single Source Quality - Hand Harvest Olive Oil Trees - Cold pressed Within 4 Hours To Lock-in all Powerful Phenolic Proprieties - Small Family Farm Limited Edition Polyphenol Rich Olive Oil - Only 3800 Liters/year EVOO Extra Virgin Olive Oil - Additive Free  Seems Natural…It’s Supernatural - Virgeen Fields Are Located On Tuscany Hills With Its Perfect Microclimate - 100% Raw Italian Olive Oil High In Polyphenols - Recreate an Authentic Mediterranean Experience With Its Natural Pure Olive Oil Fresh Gourmet Taste  Premium Italian Gift - Our Extra Virgin Olive Oil High In Polyphenols Comes with Protected Elegant Package, Italian EVOO Extra Virgin Olive Oil Recipes, Instructions For Perfect Use and Conservation. Premium Pure Olive Oil Gift - Recycled Paper Used",85.49,$,4.7,[],True,False,,,False,,new,https://m.media-amazon.com/images/I/4170G90BWuL._SX300_SY300_QL70_ML2_.jpg,"['The Best olive oil you can buy! I do a lot of cooking & cook recipes from all 7 continents!  I learned a long time ago that you NEVER buy olive oil in a plastic container!  This is packaged in a heavy, dark glass bottle & comes from Florence, Italy & is cold-pressed within 4 hours after picking!  The flavor is the best you’ll ever experience!  It might appear to be a little spendy, but when have several hours into a cooking project like velveted, fusion Chinese fried rice only to have it turn out tasting like it’s soured & stale… you’ll be happy you bought this brand of olive oil! I have 3 kids & they hate eating out at a restaurant!  They complain about restaurant quality food and almost always say… “Can’t we just stay home and you make  something that tastes delicious, scrumptious & good? I’ve been cooking for over 30 years & hate to go to restaurants, too!  Gordon Ramsay’s restaurants are the exception! Long story…short, I have what many might consider a kitchen full of expensive equipment! I think that all you need, to get a big jump on your recipes, is a great pan, good ingredients & the Virgeen brand of olive oil! Try it & use it in numerous recipes!  You’ll never even think about the cost when you taste the magic you’ve created!  Good luck & Happy cooking!', 'Authentic Premium High Class Extra Virgin Olive Oil I would never think that I could find a real extra virgin olive oil in USA!!! This is premium!!! I am so lucky and so happy that I found it. Growing up with olive oil in the Albanian villages, I am able to distinguish real olive oil from fake ones. I cannot describe the authentic taste this oil has!!! Who has tried the real extra virgin olive oil can feel it what I am saying!!! Amazing, really amazing!!!', 'This stuff tasting  great Very tasty Olive oil. Great for cooking or dipping some bread and eating. Comes in a very Nice package . It’s a bit on the pricey side but when you taste it you know where your money was spent.  Smells great,  thickness super smooth and it’s healthy for you how can you go wrong .', ""Excellent olive oil! This is my 2nd time purchasing. It has a great taste! I think it's the best tasting olive oil I've had. Definitely recommend!"", 'Olive oil Excellent, it has a unique flavor, it seems like you are putting the same olives in your mouth, that is the sensation', 'Can be given as a gift, well packaged! Top quality, with great benefits from a high polyphenol.']"
https://www.amazon.com/FL-OZ-Certified-Organic-Virgin-Pressed/dp/B086CYTN5R,64 FL.OZ Organic Extra Virgin Olive Oil Cold Pressed,100% PURE ORGANIC EXTRA VIRGIN COLD PRESSED OLIVE OIL,17.99,$,4.1,[],True,False,,,False,,new,https://m.media-amazon.com/images/I/319D1-piLFL._SX300_SY300_QL70_ML2_.jpg,"['Mui bueno para hacer aceites naturales me encanta la calidad que brinda lo volvería a comprar', 'I use Olive Oil daily for cooking.  The price of this stuff has gone sky high.  This is a decent price for 64 oz.  May be getting this regularly.', 'Great, pure, all natural product. Used it for my all natural homemade skincare products &amp; it worked out perfectly!!!', 'This is not what I paid for, product comes from India not Italy as they advertise. Now I doubt what oils is really in the bottle. So disappointed', 'this oil is weird does not taste like olive oil at all.']"
https://www.amazon.com/Baja-Precious-Extra-Virgin-Gallon/dp/B005M9VYZY,"Baja Precious - Extra Virgin Olive Oil, 1 Gallon","All Natural, First Cold Pressed, Maximum Acidity of 0.3%",17.99,$,4.6,['initial'],True,False,,,False,,new,https://m.media-amazon.com/images/I/41G70w0RawL._SX300_SY300_QL70_ML2_.jpg,"[""Fast delivery! Perfect shipping condition! Perfect taste! I'm using this in my Personal Fitness Training Company for my Healthy Shakes I make for my clients. It's perfect so far and I took some home and it's been perfect with my recipes."", 'I use a lot of olive oil.  It is surprising how much olive oil, even expensive imported olive oil, is a mish mash of different olives from different countries, and sometimes different continents!  This extra virgin olive oil, from Mexico, is excellent.  It is all estate grown and processed with a wonderful flavor and texture.  I use it for everything, even baking!  Fantastic value and quality!', 'Perfect weight and great flavor.  It is mild enough to let whatever it is carrying shine through while still letting you know it is there.', 'Make sure you have a good grip or this Bad boy can slip right out of your hand']"
https://www.amazon.com/théa-Koroneiki-Antioxidants-Unblended-Handpicked/dp/B07N8HWJ11,"théa Premium Greek Extra Virgin Olive Oil (750ml) I NEW Harvest 2023/2024 I Koroneiki Variety I First Cold Pressed I Low Acidity I Unblended I Handpicked &amp; Harvested in Kalamata, Greece","For over four generations our family has been harvesting olives in the foothills of the Peloponnese region of southern Greece. théa olive oil is sourced from our olive groves in Kalamata, Greece, which is world famous for producing some of the best extra virgin olive oil in the world.",17.99,$,4.6,[],True,False,,,False,,new,https://m.media-amazon.com/images/I/3157a0e7fdL._SX300_SY300_QL70_ML2_.jpg,"[{'reviewTitle': 'The best greek olive oil, bar none!', 'reviewBody': 'Light but tasteful. I use this brand everyday.', 'rating': 5, 'reviewDate': 'December 1, 2024'}, {'reviewTitle': 'Great flavor', 'reviewBody': 'Very good olive oil, a little pricey but not out of line for quality olive oil', 'rating': 5, 'reviewDate': 'August 8, 2024'}, {'reviewTitle': 'Superb flavor profile', 'reviewBody': 'After spending some weeks traveling and eating in Greece last year, I had acquired a recognition of the flavor profile differences between Greek olive oils and the Italian olive oils that I grew up with.  I enjoy both, but I only buy Italian oil when I am in Italy. My problem with Italian olive oils purchased here in the USA  is that producers are allowed to use olives and even olive oils from other countries and “finish” the production and bottling in Italy and then they are allowed to call it “Italian Olive Oil”.  The Greek oils are far less subject to that sort of adulteration.  This oil is 100% Greek origin and production, and it is dated.  Very transparent and I expect that.  I was exceptionally pleased with my purchase of the Théa Greek olive oil.  The light “grassiness” in the aroma is exactly what I experienced with all the Greek oils I tasted in Greece.  It has a balanced finish, not distinctly peppery, and I like that for many applications.  Also, the olive flavor does not hit you hard like many true Italian oils do, so I can use the Greek oil in sweet preparations, like an olive oil cake, and not have it come out over-olivey.  Great product.', 'rating': 5, 'reviewDate': 'June 27, 2023'}, {'reviewTitle': 'Great and Beautiful Bottle of Olive Oil', 'reviewBody': 'Great quality olive oil, beautiful bottle if you want to give it as a gift as well, and great customer service and straight from Greece. Nothing like a good olive oil that you actually know where it is coming from, one source. So many fake olive oils out there that tells you the oil come from one of the following countries and they list multiple countries and you don’t know the quality or the harvest year, those are not pure olive oils, and this one actually gives you a harvest date. This one you can tell that its a family business and straight from Greece best olive oil out there ⭐️⭐️⭐️⭐️⭐️ at a great price.', 'rating': 5, 'reviewDate': 'March 27, 2023'}, {'reviewTitle': 'Great taste but…', 'reviewBody': 'The taste is  great but there is not harvest date in the bottle like it shows it in the picture advertising it, this is one of the main reason I bought it and it’s not there please I need a response on this.', 'rating': 4, 'reviewDate': 'March 14, 2024'}, {'reviewTitle': 'This oil was good', 'reviewBody': 'Oil was good', 'rating': 5, 'reviewDate': 'October 30, 2024'}, {'reviewTitle': 'Love this!', 'reviewBody': 'No matter what it’s on, it’s delicious.', 'rating': 5, 'reviewDate': 'October 23, 2024'}, {'reviewTitle': 'They ship very fast!', 'reviewBody': 'Quality product that arrives the next day after you order it!', 'rating': 5, 'reviewDate': 'June 30, 2024'}]"
https://www.amazon.com/Lodi-Frantoio-Extra-Virgin-Olive/dp/B07YBMRGKB,Lodi Frantoio Extra Virgin Olive Oil - Premium California Olive Oil - Gourmet Frantoio Olive Oil - COOC Certified Cold Pressed Pure Olive Oil - Medium to High Intensity - 500 ml,"FRANTOIO EXTRA VIRGIN OLIVE OIL: Lodi Frantoio Olive Oil brings the best out of premium Frantoio Olives that are known around the world for their fruitiness; Layered flavor profile, pale golden color & rich, fruity aroma  MEDIUM TO SLIGHTLY HIGH INTENSITY: Our Frantoio Extra Olive Oil carries the fruity flavor of Frantoio Olives with subtle grassy notes & a late hint of green apple; Made from handpicked local Frantoio olives  COLD PRESSED EXTRA VIRGIN OLIVE OIL: Our extra virgin olive oils guarantee minimal processing through cutting-edge cold extraction techniques; Works amazingly well with simple & complex foods, from artisan breads to balsamic vinegars  MADE IN CALIFORNIA: All Lodi Olive Oil products are made in California to ensure the highest standards of quality, processing & packaging; COOC Certified California olive oil; No preservatives, trans-fats or added chemicals; Pure olive oil  THE COLDANI LEGACY: Lodi Olive Oil is a brand owned & run by the legendary Coldani family famous for their Lodi-Delta region olive groves; The finest olive oil experience, packaged in a tasteful new avatar; Click ‘Add to Cart’ to order",17.99,$,4.2,[],True,False,,,False,,new,https://m.media-amazon.com/images/I/410MsYlgZFL._SX300_SY300_QL70_ML2_.jpg,"[""Bought this as a housewarming gift for my mother-in-law, and she hasn't stopped raving about it. It has been great for finishing roast veggies and potatoes, as well as for dipping crusty sourdough bread. It is bright and clean, with a fantastic bite and grassiness. I'm ordering another bottle for our house."", 'This is the best olive oil I’ve ever tasted. It’s absolutely bursting with bright green fresh fruity flavor and has zero bitterness. I just wish it were not so expensive.', ""Looks like the brand didn't had COOC seal for 2021. I am not sure am I the one to receive this Oil without COOC seal, so I am looking for another Olive Oil which is certified by COOC"", 'Good quality olive oil', 'Great product. Rich. Flavorful.', 'Good quality olive oil']"
https://www.amazon.com/Pressed-Polyphenol-American-Unrefined-Certified/dp/B0CGTMYBR3,"Fresh Press Farms Cold Pressed High Polyphenol Pure Gold Extra Virgin Olive Oil, 16.4 Fl Oz (Pack of 2), Georgia Grown, 100% American Made, Unrefined, Certified Whole30, Non-GMO, Keto, Paleo, Gluten Free, Packaging May Vary","Inspired by Nature: Cold pressed, high oleic and high polyphenols for quality, flavor and health benefits. Includes 2 Recyclable Aluminum Bottles of our High Heat EVOO with a convenient spout for that perfect pour! High Polyphenol: Batch tested providing 2X Polyphenols equal to 1,000 mg per Liter (14 mg per serving) for the highest polyphenol content on the market. Extra bold flavor for anything from salads to sautéed vegetables to pastas. Medium cooking temperature Nutrient-Dense: Our cold pressing technology preserves all the nutrients and polyphenols present in our olives. Our oils are packed with Vitamins E, A, B, C & D and is rich in powerful Omega-9s High in Antioxidants: Rich in heart healthy polyphenols with antioxidant properties. Non-GMO, Kosher, Keto friendly, Whole30 and Paleo Certified Georgia Grown: We proudly grow, harvest, cold press and bottle our oils locally to ensure freshness with a quick trip from our grove to your pantry",29.90,$,4.5,"['Bold', 'Classic', 'High Heat', 'High Polyphenol', 'Mild']",True,False,,,False,,new,https://m.media-amazon.com/images/I/41+IKtL8bgL._SX300_SY300_QL70_ML2_.jpg,"['In my humble opinion, the best authentic olive oil made in the USA.', 'Beautiful gift-worthy bottles & delightful olive oil', 'Great Product', 'Olive, or what?! Wow!', 'This is what high quality olive oil should be!']"
https://www.amazon.com/Fresh-Press-Farms-Classic-Pressed/dp/B0BB8Q1587,"Fresh Press Farms Cold Pressed Classic Extra Virgin Olive Oil, 16.4 Fl Oz (Pack of 2), Georgia Grown, 100% American Made, Unrefined, Certified Whole30, Non-GMO, Keto, Paleo, Gluten Free","Inspired by Nature: Cold pressed & high oleic for quality, flavor and health benefits. Includes 2 Recyclable Aluminum Bottles of our Classic EVOO with a convenient spout for that perfect pour!  Unmatched Fresh Flavor: For anything from salads to sautéed vegetables to pastas. Medium cooking temperature. A classic oil that enhances any meal  Nutrient-Dense: Our cold pressing technology preserves all the nutrients and polyphenols. Packed with Vitamins E, A, B, C & D and rich in powerful Omega-9s  Heart Healthy: Our oils offer a very high percentage of monounsaturated fat, which is important for your heart. Non-GMO, Kosher, Keto friendly, Whole30 and Paleo Certified  Georgia Grown: We proudly grow, harvest, cold press and bottle our oils locally to ensure freshness with a quick trip from our grove to your pantry",21.95,$,4.5,"['Classic', 'Bold', 'High Heat', 'High Polyphenol', 'Mild']",True,False,,,False,,new,https://m.media-amazon.com/images/I/41dqimO8npL._SX300_SY300_QL70_ML2_.jpg,"['In my humble opinion, the best authentic olive oil made in the USA.', 'Beautiful gift-worthy bottles & delightful olive oil', 'Great Product', 'Olive, or what?! Wow!', 'High Quality and Great Tasting']"
https://www.amazon.com/Fresh-Press-Farms-Pressed-Locally/dp/B0BB8JPSKJ,"Fresh Press Farms Cold Pressed Bold Extra Virgin Olive Oil, 16.4 Fl Oz (Pack of 2), Georgia Grown, 100% American Made, Unrefined, Certified Whole30, Non-GMO, Keto, Paleo, Gluten Free","Inspired by Nature: Cold pressed & high oleic for quality, flavor and health benefits. Includes 2 Recyclable Aluminum Bottles of our Bold EVOO with a convenient spout for that perfect pour!  Unmatched Fresh Flavor: A bold robust flavor perfect for marinades, salad dressings, bread dipping, and drizzling. Low to medium cooking temperature. Adds a full flavor to your favorite recipes  Nutrient-Dense: Our cold pressing technology preserves all the nutrients and polyphenols present in our olives. Our oils are packed with Vitamins E, A, B, C & D and is rich in powerful Omega-9s  Heart Healthy: Our oils offer a very high percentage of monounsaturated (good) fat. Non-GMO, Keto friendly, Whole30 and Paleo Certified  Georgia Grown: We proudly grow, harvest, cold press and bottle our oils locally to ensure freshness with a quick trip from our grove to your pantry",27.95,$,4.5,"['Bold', 'Classic', 'High Heat', 'High Polyphenol', 'Mild']",True,False,,,False,,new,https://m.media-amazon.com/images/I/41f4-MimuwL._SX300_SY300_QL70_ML2_.jpg,"['In my humble opinion, the best authentic olive oil made in the USA.', 'Beautiful gift-worthy bottles & delightful olive oil', 'Great Product', 'Olive, or what?! Wow!', 'High Quality and Great Tasting', 'Meh.....']"
https://www.amazon.com/Georgia-Olive-Farms-Extra-Virgin/dp/B07641GK6H,"GEORGIA OLIVE FARMS Extra Virgin Olive Oil, 16.9 FZ","<p> <p><span><br/>Are you on a strict health diet? If so, get ready to fall in love and do not miss out a pantry staple - Georgia Olivia Farms extra virgin olive oil! Our unfiltered EVOO (extra virgin olive oil) is free from hydrogenated fats, high fructose corn syrup, and bleached/bromated flour, making it safe for people with a strict diet regimen. <br/> <br/></span><span class=""a-text-bold"">TASTE THE CALIFORNIA OLIVES AT THE COMFORT OF YOUR HOME</span><span> <br/> <br/>Georgia Olive Farms Chef’s Blend Extra Virgin Olive Oil: Premium olive oil from super high-density olive trees. We source our olives from our own farm in California &amp; process them in our own mill in less than 24 hours! <br/> <br/></span><span class=""a-text-bold"">MAKE YOUR MEALS MORE SPECIAL</span><span> <br/> <br/>Pasta Noodles, Salmon, Roasted Veggies, Salads, he list can go on how you can make use of our special olive oil. You can also mix this fresh olive oil with balsamic vinegar for a savory bread dipping. Try our EVOO to make your meals special from breakfast through dinner. <br/> <br/></span><span class=""a-text-bold"">ADD IT TO THE FOOD GIFT BASKET</span><span> <br/> <br/>Surprise the chef or food lover in your love when you add our olive oil to your cooking gifts! Ideal to be a part of gourmet gift baskets, Christmas gift baskets, and food gifts.</span></p> </p>",29.95,$,4.6,"['initial', 'PT01', 'PT02', 'PT03', 'PT04', 'PT05', 'PT06']",True,False,,,False,,new,https://m.media-amazon.com/images/I/31tyEa2rauL._SX300_SY300_QL70_ML2_.jpg,"[{'reviewer': 'Barbara Hock', 'rating': '5.0', 'review': ""This olive oil was a part of a gift basket for my mom who loves this olive oil and uses it for salad dressings. For every day cooking, she uses one that isn't as pricey.""}, {'reviewer': 'Susan W.', 'rating': '5.0', 'review': ""I first bought this olive oil blend at a craft fair in Carrabelle, Florida.  I immediately wished I had bought more than one bottle.  So smooth with the most delicious buttery flavor.  I am in love with this olive oil blend.  It's the best I have ever tasted.  I was so happy to find it on Amazon and have since bought more bottles and will buy more still.  So good!  You just have to try it.""}, {'reviewer': 'Louis Consolaro', 'rating': '5.0', 'review': 'This is a great product with a very good taste and it’s from Ga. USA.'}, {'reviewer': 'Brian Tru', 'rating': '4.0', 'review': 'Overall, the oil is good. In prior purchases, the taste was fresher and more robust. The harvest date on this bottle was Fall 2022. 15 months ago.'}, {'reviewer': 'Dr Andy', 'rating': '5.0', 'review': ""Superb taste. After this, you'll realize what olive oil should be. Great for any use.""}, {'reviewer': 'Mary Righton Brown', 'rating': '5.0', 'review': 'It’s very delicious and high quality!'}]"
